Exchange,Symbol,Shortname,Longname,Sector,Industry,Currentprice,Marketcap,Ebitda,Revenuegrowth,City,State,Country,Fulltimeemployees,Longbusinesssummary,Weight
NMS,AAPL,Apple Inc.,Apple Inc.,Technology,Consumer Electronics,254.49,3846819807232,134660997120.0,0.061,Cupertino,CA,United States,164000.0,"Apple Inc. designs, manufactures, and markets smartphones, personal computers, tablets, wearables, and accessories worldwide. The company offers iPhone, a line of smartphones; Mac, a line of personal computers; iPad, a line of multi-purpose tablets; and wearables, home, and accessories comprising AirPods, Apple TV, Apple Watch, Beats products, and HomePod. It also provides AppleCare support and cloud services; and operates various platforms, including the App Store that allow customers to discover and download applications and digital content, such as books, music, video, games, and podcasts, as well as advertising services include third-party licensing arrangements and its own advertising platforms. In addition, the company offers various subscription-based services, such as Apple Arcade, a game subscription service; Apple Fitness+, a personalized fitness service; Apple Music, which offers users a curated listening experience with on-demand radio stations; Apple News+, a subscription news and magazine service; Apple TV+, which offers exclusive original content; Apple Card, a co-branded credit card; and Apple Pay, a cashless payment service, as well as licenses its intellectual property. The company serves consumers, and small and mid-sized businesses; and the education, enterprise, and government markets. It distributes third-party applications for its products through the App Store. The company also sells its products through its retail and online stores, and direct sales force; and third-party cellular network carriers, wholesalers, retailers, and resellers. Apple Inc. was founded in 1976 and is headquartered in Cupertino, California.",0.0692091524397274
NMS,NVDA,NVIDIA Corporation,NVIDIA Corporation,Technology,Semiconductors,134.7,3298803056640,61184000000.0,1.224,Santa Clara,CA,United States,29600.0,"NVIDIA Corporation provides graphics and compute and networking solutions in the United States, Taiwan, China, Hong Kong, and internationally. The Graphics segment offers GeForce GPUs for gaming and PCs, the GeForce NOW game streaming service and related infrastructure, and solutions for gaming platforms; Quadro/NVIDIA RTX GPUs for enterprise workstation graphics; virtual GPU or vGPU software for cloud-based visual and virtual computing; automotive platforms for infotainment systems; and Omniverse software for building and operating metaverse and 3D internet applications. The Compute & Networking segment comprises Data Center computing platforms and end-to-end networking platforms, including Quantum for InfiniBand and Spectrum for Ethernet; NVIDIA DRIVE automated-driving platform and automotive development agreements; Jetson robotics and other embedded platforms; NVIDIA AI Enterprise and other software; and DGX Cloud software and services. The company's products are used in gaming, professional visualization, data center, and automotive markets. It sells its products to original equipment manufacturers, original device manufacturers, system integrators and distributors, independent software vendors, cloud service providers, consumer internet companies, add-in board manufacturers, distributors, automotive manufacturers and tier-1 automotive suppliers, and other ecosystem participants. NVIDIA Corporation was incorporated in 1993 and is headquartered in Santa Clara, California.",0.0593496381573215
NMS,TSLA,"Tesla, Inc.","Tesla, Inc.",Consumer Cyclical,Auto Manufacturers,421.06,1351627833344,13244000256.0,0.078,Austin,TX,United States,140473.0,"Tesla, Inc. designs, develops, manufactures, leases, and sells electric vehicles, and energy generation and storage systems in the United States, China, and internationally. The company operates in two segments, Automotive, and Energy Generation and Storage. The Automotive segment offers electric vehicles, as well as sells automotive regulatory credits; and non-warranty after-sales vehicle, used vehicles, body shop and parts, supercharging, retail merchandise, and vehicle insurance services. This segment also provides sedans and sport utility vehicles through direct and used vehicle sales, a network of Tesla Superchargers, and in-app upgrades; purchase financing and leasing services; services for electric vehicles through its company-owned service locations and Tesla mobile service technicians; and vehicle limited warranties and extended service plans. The Energy Generation and Storage segment engages in the design, manufacture, installation, sale, and leasing of solar energy generation and energy storage products, and related services to residential, commercial, and industrial customers and utilities through its website, stores, and galleries, as well as through a network of channel partners; and provision of service and repairs to its energy product customers, including under warranty, as well as various financing options to its solar customers. The company was formerly known as Tesla Motors, Inc. and changed its name to Tesla, Inc. in February 2017. Tesla, Inc. was incorporated in 2003 and is headquartered in Austin, Texas.",0.0243174937863789
NYQ,JPM,JP Morgan Chase & Co.,JPMorgan Chase & Co.,Financial Services,Banks - Diversified,237.6,668924837888,,0.03,New York,NY,United States,316043.0,"JPMorgan Chase & Co. operates as a financial services company worldwide. It operates through three segments: Consumer & Community Banking, Commercial & Investment Bank, and Asset & Wealth Management. It offers deposit, investment and lending products, cash management, and payments and services; mortgage origination and servicing activities; residential mortgages and home equity loans; and credit cards, auto loans, leases, and travel services to consumers and small businesses through bank branches, ATMs, and digital and telephone banking. The company also provides investment banking products and services, including corporate strategy and structure advisory, and equity and debt market capital-raising services, as well as loan origination and syndication; payments; and cash and derivative instruments, risk management solutions, prime brokerage, and research, as well as offers securities services, including custody, fund accounting and administration, and securities lending products for asset managers, insurance companies, and public and private investment funds. In addition, it provides financial solutions, including lending, payments, investment banking, and asset management to small and midsized companies, local governments, nonprofit clients, and large corporations, as well as investors, developers, and owners of multifamily, office, retail, industrial, and affordable housing properties. Further, the company offers multi-asset investment management solutions in equities, fixed income, alternatives, and money market funds to institutional clients and retail investors; and retirement products and services, brokerage, custody, estate planning, lending, deposits, and investment management products to high net worth clients. JPMorgan Chase & Co. was founded in 1799 and is headquartered in New York, New York.",0.0120348036549762
NYQ,XOM,Exxon Mobil Corporation,Exxon Mobil Corporation,Energy,Oil & Gas Integrated,105.87,465308188672,71537999872.0,-0.015,Spring,TX,United States,62000.0,"Exxon Mobil Corporation engages in the exploration and production of crude oil and natural gas in the United States and internationally. It operates through Upstream, Energy Products, Chemical Products, and Specialty Products segments. The Upstream segment explores for and produces crude oil and natural gas. The Energy Products segment offers fuels, aromatics, and catalysts, as well as licensing services. It sells its products under the Exxon, Esso, and Mobil brands. The Chemical Products segment manufactures and markets petrochemicals including olefins, polyolefins, and intermediates. The Specialty Products segment offers performance products, including lubricants, basestocks, waxes, synthetics, elastomers, and resins. The company also involves in the manufacturing, trade, transport, and sale of crude oil, natural gas, petroleum products, petrochemicals, and other specialty products; and pursuit lower-emission business opportunities, including carbon capture and storage, hydrogen, lower-emission fuels, and lithium. Exxon Mobil Corporation was founded in 1870 and is based in Spring, Texas.",0.0083714826727031
NYQ,PG,Procter & Gamble Company (The),The Procter & Gamble Company,Consumer Defensive,Household & Personal Products,168.06,395788025856,24039999488.0,-0.006,Cincinnati,OH,United States,108000.0,"The Procter & Gamble Company engages in the provision of branded consumer packaged goods worldwide. The company operates through five segments: Beauty; Grooming; Health Care; Fabric & Home Care; and Baby, Feminine & Family Care. The Beauty segment offers conditioners, shampoos, styling aids, and treatments under the Head & Shoulders, Herbal Essences, Pantene, and Rejoice brands; and antiperspirants and deodorants, personal cleansing, and skin care products under the Olay, Old Spice, Safeguard, Secret, SK-II, and Native brands. The Grooming segment provides blades and razors, shave products, appliances, and other grooming products under the Braun, Gillette, and Venus brand names. The Health Care segment offers toothbrushes, toothpastes, and other oral care products under the Crest and Oral-B brand names; and gastrointestinal, pain relief, rapid diagnostics, respiratory, vitamins/minerals/supplements, and other personal health care products under Metamucil, Neurobion, Pepto-Bismol, and Vicks brands. The Fabric & Home Care segment provides fabric enhancers, laundry additives, and laundry detergents under the Ariel, Downy, Gain, and Tide brands; and air care, dish care, P&G professional, and surface care products under the Cascade, Dawn, Fairy, Febreze, Mr. Clean, and Swiffer brands. The Baby, Feminine & Family Care segment offers baby wipes, and taped diapers and pants under the Luvs and Pampers brands; adult incontinence and feminine care products under the Always, Always Discreet, and Tampax brands; and paper towels, tissues, and toilet papers under the Bounty, Charmin, and Puffs brands. It sells its products primarily through mass merchandisers, e-commerce, grocery stores, membership club stores, drug stores, department stores, distributors, wholesalers, specialty beauty stores, high-frequency stores, pharmacies, electronics stores, and professional channels, as well as directly to consumers. The company was founded in 1837 and is headquartered in Cincinnati, Ohio.",0.0071207270389399
NYQ,BAC,Bank of America Corporation,Bank of America Corporation,Financial Services,Banks - Diversified,44.17,338911100928,,-0.005,Charlotte,NC,United States,213000.0,"Bank of America Corporation, through its subsidiaries, provides banking and financial products and services for individual consumers, small and middle-market businesses, institutional investors, large corporations, and governments worldwide. It operates in four segments: Consumer Banking, Global Wealth & Investment Management (GWIM), Global Banking, and Global Markets. The Consumer Banking segment offers traditional and money market savings accounts, certificates of deposit and IRAs, non-interest and interest-bearing checking accounts, and investment accounts and products; credit and debit cards; residential mortgages, and home equity loans; and direct and indirect loans, such as automotive, recreational vehicle, and consumer personal loans. The GWIM segment provides investment management, brokerage, banking, and trust and retirement products and services; wealth management solutions; and customized solutions, including specialty asset management services. The Global Banking segment offers lending products and services, including commercial loans, leases, commitment facilities, trade finance, and commercial real estate and asset-based lending; treasury solutions, such as treasury management, foreign exchange, short-term investing options, and merchant services; working capital management solutions; debt and equity underwriting and distribution, and merger-related and other advisory services; and fixed-income and equity research, and certain market-based services. The Global Markets segment provides market-making, financing, securities clearing, settlement, and custody services; securities and derivative products; and risk management products using interest rate, equity, credit, currency and commodity derivatives, foreign exchange, fixed-income, and mortgage-related products. Bank of America Corporation was founded in 1784 and is based in Charlotte, North Carolina.",0.0060974392415119
NYQ,CVX,Chevron Corporation,Chevron Corporation,Energy,Oil & Gas Integrated,142.85,254690115584,38942998528.0,-0.064,San Ramon,CA,United States,45600.0,"Chevron Corporation, through its subsidiaries, engages in the integrated energy and chemicals operations in the United States and internationally. The company operates in two segments, Upstream and Downstream. The Upstream segment is involved in the exploration, development, production, and transportation of crude oil and natural gas; processing, liquefaction, transportation, and regasification of liquefied natural gas; transportation of crude oil through pipelines; transportation, storage, and marketing of natural gas; and carbon capture and storage, as well as a gas-to-liquids plant. The Downstream segment refines crude oil into petroleum products; markets crude oil, refined products, and lubricants; manufactures and markets renewable fuels, commodity petrochemicals, plastics for industrial uses, and fuel and lubricant additives; and transports crude oil and refined products by pipeline, marine vessel, motor equipment, and rail car. The company was formerly known as ChevronTexaco Corporation and changed its name to Chevron Corporation in 2005. Chevron Corporation was founded in 1879 and is headquartered in San Ramon, California.",0.004582197222029
NYQ,ACN,Accenture plc,Accenture plc,Technology,Information Technology Services,366.37,229157109760,11065912320.0,0.026,Dublin,,Ireland,774000.0,"Accenture plc provides strategy and consulting, industry X, song, and technology and operation services in North America, Europe, the Middle East, Africa, and internationally. It offers systems integration and application management; security; intelligent platform; infrastructure; software engineering; data and AI; and automation services. The company also operates business processes; and designs, manufactures, and assembles automation equipment, robotics, and other commercial hardware products. It serves communications, media, and technology; banking and capital markets, and insurance; health and public service; consumer goods, retail, travel services; industrial; life science; chemicals, natural resources, energy, and utilities sectors. It has collaboration agreement with Kyoto University to advance learning, research, and innovation in human-centered  AI. The company was founded in 1951 and is based in Dublin, Ireland.",0.0041228261620705
NYQ,BX,Blackstone Inc.,Blackstone Inc.,Financial Services,Asset Management,170.84,207208415232,,0.541,New York,NY,United States,4735.0,"Blackstone Inc. is an alternative asset management firm specializing in private equity, real estate, hedge fund solutions, credit, secondary funds of funds, public debt and equity and multi-asset class strategies. The firm typically invests in early-stage, seed, middle market, mature, late venture and later stage companies. It also provide capital markets services. The real estate segment specializes in opportunistic, core+ investments as well as debt investment opportunities collateralized by commercial real estate, and stabilized income-oriented commercial real estate across North America, Europe and Asia. The firm's corporate private equity business pursues transactions throughout the world across a variety of transaction types, including large buyouts, recapitalization, special situations, distressed mortgage loans, mid-cap buyouts, buy and build platforms, which involves multiple acquisitions behind a single management team and platform, and growth equity/development projects involving significant majority stakes in portfolio companies and minority investments in operating companies, shipping, real estate, corporate or consumer loans, and alternative energy greenfield development projects in energy and power, property, dislocated markets, shipping opportunities, financial institution breakups, re-insurance, and improving freight mobility, financial services, healthcare, life sciences, infrastructure, enterprise tech and consumer, as well as consumer technologies. The firm considers investment in Asia and Latin America. It seeks to invest between $0.25 million and $900 million per transaction. It invests in companies with enterprise value between $500 million and $5000 million. It has a three year investment period. The firm prefers to take majority and minority stakes. Its hedge fund business manages a broad range of commingled and customized fund solutions and its credit business focuses on loans, and securities of non-investment grade companies spread across the capital structure including senior debt, subordinated debt, preferred stock and common equity. Blackstone Inc. was founded in 1985 and is headquartered in New York, New York with additional offices across Asia, Europe, North America and Central America.",0.003727941394506
NYQ,DIS,Walt Disney Company (The),The Walt Disney Company,Communication Services,Entertainment,112.03,202879614976,16750999552.0,0.037,Burbank,CA,United States,173250.0,"The Walt Disney Company operates as an entertainment company worldwide. It operates through three segments: Entertainment, Sports, and Experiences. The company produces and distributes film and television video streaming content under the ABC Television Network, Disney, Freeform, FX, Fox, National Geographic, and Star brand television channels, as well as ABC television stations and A+E television networks; and produces original content under the ABC Signature, Disney Branded Television, FX Productions, Lucasfilm, Marvel, National Geographic Studios, Pixar, Searchlight Pictures, Twentieth Century Studios, 20th Television, and Walt Disney Pictures banners. It also offers direct-to-consumer streaming services through Disney+, Disney+ Hotstar, Hulu, and Star+; sports-related entertainment services through ESPN, ESPN on ABC, ESPN+ DTC, and Star; sale/licensing of film and episodic content to third-party television and VOD services; theatrical, home entertainment, and music distribution services; DVD and Blu-ray discs, electronic home video licenses, and VOD rental services; staging and licensing of live entertainment events; and post-production services. In addition, the company operates theme parks and resorts comprising Walt Disney World Resort, Disneyland Resort, Disneyland Paris, Hong Kong Disneyland Resort, Shanghai Disney Resort, Disney Cruise Line, Disney Vacation Club, National Geographic Expeditions, and Adventures by Disney, as well as Aulani, a Disney resort and spa in Hawaii. It also licenses its intellectual property to a third party for operations of the Tokyo Disney Resort; licenses trade names, characters, visual, literary, and other IP for use on merchandise, published materials, and games; operates a direct-to-home satellite distribution platform; sells branded merchandise through retail, online, and wholesale businesses; and develops and publishes books, comic books, and magazines. The company was founded in 1923 and is based in Burbank, California.",0.0036500608043532
NMS,PLTR,Palantir Technologies Inc.,Palantir Technologies Inc.,Technology,Software - Infrastructure,80.55,183494524928,397707008.0,0.3,Denver,CO,United States,3892.0,"Palantir Technologies Inc. builds and deploys software platforms for the intelligence community to assist in counterterrorism investigations and operations in the United States, the United Kingdom, and internationally. The company provides Palantir Gotham, a software platform which enables users to identify patterns hidden deep within datasets, ranging from signals intelligence sources to reports from confidential informants, as well as facilitates the handoff between analysts and operational users, helping operators plan and execute real-world responses to threats that have been identified within the platform. It also offers Palantir Foundry, a platform that transforms the ways organizations operate by creating a central operating system for their data; and allows individual users to integrate and analyze the data they need in one place. In addition, it provides Palantir Apollo, a software that delivers software and updates across the business, as well as enables customers to deploy their software virtually in any environment; and Palantir Artificial Intelligence Platform (AIP) that provides unified access to open-source, self-hosted, and commercial large language models (LLM) that can transform structured and unstructured data into LLM-understandable objects and can turn organizations' actions and processes into tools for humans and LLM-driven agents. The company was incorporated in 2003 and is headquartered in Denver, Colorado.",0.0033012985229311
NMS,INTU,Intuit Inc.,Intuit Inc.,Technology,Software - Application,643.39,180095795200,4496000000.0,0.41,Mountain View,CA,United States,18800.0,"Intuit Inc. provides financial management, compliance, and marketing products and services in the United States. The company operates in four segments: Small Business & Self-Employed, Consumer, Credit Karma, and ProTax. The Small Business & Self-Employed segment provides QuickBooks services, that includes financial and business management online services, desktop software, payroll solutions, time tracking, merchant payment processing and bill pay solutions, checking accounts, and financing services for small and mid-market businesses; and Mailchimp, a marketing automation and customer relationship management. This segment also offers QuickBooks online services and desktop software solutions comprising QuickBooks Online, QuickBooks Live, QuickBooks Online Advanced, QuickBooks Self-Employed, QuickBooks Solopreneur financial and business management offerings, QuickBooks Online Payroll QuickBooks Checking, QuickBooks Desktop software subscriptions, QuickBooks Basic Payroll, QuickBooks Assisted Payroll, and QuickBooks Enhanced Payroll. The Consumer segment provides do-it-yourself and assisted TurboTax income tax preparation products and services. The Credit Karma segment offers consumers with a personal finance platform that provides personalized recommendations of credit card, home, auto, and personal loan, and insurance product; online savings and checking accounts; and access to its credit scores and reports, credit and identity monitoring, credit report dispute, credit building tools, and tools. The ProTax segment provides Lacerte, ProSeries, and ProFile desktop tax-preparation software products; and ProConnect Tax Online bill pay tax products, electronic tax filing service, and bank products and related services. It sells products and services through direct sales channels, multi-channel shop-and-buy experiences, mobile application stores, and partner and other channels. The company was incorporated in 1984 and is headquartered in Mountain View, California.",0.0032401510776038
NYQ,GS,"Goldman Sachs Group, Inc. (The)","The Goldman Sachs Group, Inc.",Financial Services,Capital Markets,566.1,177704452096,,0.042,New York,NY,United States,46400.0,"The Goldman Sachs Group, Inc., a financial institution, provides a range of financial services for corporations, financial institutions, governments, and individuals worldwide. It operates through Global Banking & Markets, Asset & Wealth Management, and Platform Solutions segments. The Global Banking & Markets segment provides financial advisory services, including strategic advisory assignments related to mergers and acquisitions, divestitures, corporate defense activities, restructurings, and spin-offs; and relationship lending, and acquisition financing, as well as secured lending, through structured credit and asset-backed lending and involved in financing under securities to resale agreements. This segment also offers client execution activities for cash and derivative instruments; credit and interest rate products; and provision of mortgages, currencies, commodities, and equities related products, as well as underwriting services. The Asset & Wealth Management segment manages assets across various classes, including equity, fixed income, hedge funds, credit funds, private equity, real estate, currencies, and commodities; and provides customized investment advisory solutions, wealth advisory services, personalized financial planning, and private banking services, as well as invests in corporate equity, credit, real estate, and infrastructure assets. The Platform Solutions segment offers credit cards and point-of-sale financing for purchase of goods or services. This segment also provides cash management services, such as deposit-taking and payment solutions for corporate and institutional clients. The Goldman Sachs Group, Inc. was founded in 1869 and is headquartered in New York, New York.",0.0031971277914314
